{
  "artifact_bindings": {
    "artifact_binding_root": "78e7ca15ae8ab1011511fb9c5d6ad072d9ddc4148a3f24c9c7f99fa88e01b2cf",
    "artifact_count": 14,
    "bindings": [
      {
        "artifact_binding_hash": "f447058ee3d843a2bddfa75a72be8da1cceab1bc5fb73c578893d84fe4502dbe",
        "declared_hash": "cef2902c79515d35f166ccc06043c16c43519a4eb95e2504d872d29d96478280",
        "hash_reproducible": true,
        "name": "universal_training_serving_contract",
        "payload_hash": "53bb198e150d39560e81f48e073e174224bdec4b60f3096ed785076f76c47273",
        "present": true,
        "status": "ready",
        "target_level": "RDLLM-L143",
        "version": "rdllm-universal-training-serving-contract/v1"
      },
      {
        "artifact_binding_hash": "f795a01c775943c37887a6a113ea269e34bd60c32cd454f8501fa82c84c67460",
        "declared_hash": "22848d36987d3822e827a99185d87268ea34f40c4311c84ad4eb913f1322de13",
        "hash_reproducible": true,
        "name": "universal_grounded_reuse_contract",
        "payload_hash": "007cf9fd1a28df0c6d35afca11738f1017bcb82a38f8a0f5fe0d66e9a0e02cb2",
        "present": true,
        "status": "ready",
        "target_level": "RDLLM-L142",
        "version": "rdllm-universal-grounded-reuse-contract/v1"
      },
      {
        "artifact_binding_hash": "d149ceec92783ab9e64ffcdf670a2a807e2832915c42d6acf19821198d555d3b",
        "declared_hash": "02f3172634a1ec03a81c458b57250114c53b1a58056a5b4710f1c63b4e768599",
        "hash_reproducible": true,
        "name": "universal_citation_verification_contract",
        "payload_hash": "ccd503298ca5f44653c61f69f33c2ddae7925bc732ea3303317d5f11a126c941",
        "present": true,
        "status": "ready",
        "target_level": "RDLLM-L141",
        "version": "rdllm-universal-citation-verification-contract/v1"
      },
      {
        "artifact_binding_hash": "d464de059a7ef634ec86df0e607a96faee90373b6364fe8611b4dc8f2d61ccc4",
        "declared_hash": "0b2b195990cf75a025133f0430323bf785cfa3d4b1f08e65b60cbc14cfafa46f",
        "hash_reproducible": true,
        "name": "certification_report",
        "payload_hash": "f49bd23fd470bb8dc407b75a98f4872bfd736a2368e3984837feec627849eb18",
        "present": true,
        "status": "passed",
        "target_level": "RDLLM-L145",
        "version": "rdllm-certification/v1"
      },
      {
        "artifact_binding_hash": "8539620ac78a340dabff322397bf55932334085d96cd1739dc7d1e741c60fdff",
        "declared_hash": "523e09e9f34fa415f5b053f10387616deb8d76c45662b302612b8654e80331c9",
        "hash_reproducible": true,
        "name": "certification_attestation",
        "payload_hash": "66f8d120cf3285711ad8f9e04bef55be6d7d8d08777f2182876b8512e46ebba2",
        "present": true,
        "status": "attested",
        "target_level": "RDLLM-L52",
        "version": "rdllm-certification-attestation/v1"
      },
      {
        "artifact_binding_hash": "941b51acf11efed1f11a8c95d149735fe3ff5f6ce656c9abc0921760214e7d77",
        "declared_hash": "f2450c14fcfaf2425ce541628b9e000109ed99d77c80007006f79f41b583d9f2",
        "hash_reproducible": true,
        "name": "provider_attribution_card",
        "payload_hash": "ad9652cceb7023349fd2d93af3f66549e981542e0f8bc4904da9ab95c91edd7d",
        "present": true,
        "status": "",
        "target_level": "",
        "version": "rdllm-provider-attribution-card/v1"
      },
      {
        "artifact_binding_hash": "b1d934e6890d120f9b1764a56540dbd5b5847c6ca2047f2c3de254b2d43f2636",
        "declared_hash": "887730355cbecfde44dba810b5054e02b4a120269d3e3d113197a0da0f58e1a0",
        "hash_reproducible": true,
        "name": "integration_profile",
        "payload_hash": "3da0c33b67567fc8873836c0d78acda3ec7711024231a640fbcaec9710b5df31",
        "present": true,
        "status": "ready",
        "target_level": "",
        "version": "rdllm-integration-profile/v1"
      },
      {
        "artifact_binding_hash": "c18481917e8c8bba4be0bbf6ad5b78be1b181ac61fb37b9d7377082991234f8f",
        "declared_hash": "3f0a740782b9f8506b8244b81446d54bf0b7f4be49938be568d373a2344582cb",
        "hash_reproducible": true,
        "name": "training_content_summary",
        "payload_hash": "0ab2bac1c7ff36168e91c6de1d880063d817881f5a9d5027dbea01cebd2853d0",
        "present": true,
        "status": "",
        "target_level": "",
        "version": "rdllm-training-content-summary/v1"
      },
      {
        "artifact_binding_hash": "3510ceb4a0b74e2b4f9514fd46065cd04c1b85c20f64711e68ead7b9fcc6a3f5",
        "declared_hash": "7ffe19925fd9fa4efb042b00fb60adc0032e963dccdce2dcfba61bd5d614274b",
        "hash_reproducible": true,
        "name": "training_memory_provenance",
        "payload_hash": "fff628082b9a2f797ad28c4f258961b393c4a596943111fab50579b1ce28ab76",
        "present": true,
        "status": "ready",
        "target_level": "RDLLM-L81",
        "version": "rdllm-training-memory-provenance/v1"
      },
      {
        "artifact_binding_hash": "21bd722649d76b1bb1c8487d06fb29288f9dc37ae8de18412ecd10c1920ae3cf",
        "declared_hash": "c5b8e5cab487846f4f2acf26c87417c46e1a543cdc44930a47367ba639a7c877",
        "hash_reproducible": true,
        "name": "post_training_signal_provenance",
        "payload_hash": "b852a190912045ac6639e6da3c81ff9a1e52b8cd0b4ef6edfa340fa4e63c988a",
        "present": true,
        "status": "ready",
        "target_level": "RDLLM-L108",
        "version": ""
      },
      {
        "artifact_binding_hash": "f3bb1284c8e51981985c49bdb7bf76459397af6d0a8848a501b4ce9666ae6849",
        "declared_hash": "b26138feb51ab43c814136e1c386e324661ed9aafa37d94a53fc025b0e9961f1",
        "hash_reproducible": true,
        "name": "residual_corpus_royalty_report",
        "payload_hash": "28a90dc9d41fb5e813508c8f9ea0ca448f260bbcfe2771f3a7f72350ca2b5e37",
        "present": true,
        "status": "ready",
        "target_level": "RDLLM-L95",
        "version": ""
      },
      {
        "artifact_binding_hash": "a465ce5d9d4ee520cd9bdc85263bb0856915f9502964147aa44c5dcb53781c59",
        "declared_hash": "f860e8c67c2052e3db0bd149b25c941409f8fae7fecd187b8b0ceb4a75c066b3",
        "hash_reproducible": true,
        "name": "valuation_method_audit_report",
        "payload_hash": "d689beed0373c57055e241ad93e560144fc9026d108fe0db19b146a79a0f8e41",
        "present": true,
        "status": "ready",
        "target_level": "RDLLM-L96",
        "version": ""
      },
      {
        "artifact_binding_hash": "3d0171e49faad7796f1c978ef6a8ed027a4e2961acdcf3c26a7f13f193c8c4c4",
        "declared_hash": "98d71bb8ee99504b9f000419d66d7e7326dc2a4d849f8eddf9837fe17b343ef0",
        "hash_reproducible": true,
        "name": "foundation_model_deployment_attestation",
        "payload_hash": "d090f8544dc8bf7e79e15760915ea48bc1e0d1da5131b16dc506bc8c2cc223c6",
        "present": true,
        "status": "released",
        "target_level": "RDLLM-L129",
        "version": "rdllm-foundation-model-deployment-attestation/v1"
      },
      {
        "artifact_binding_hash": "aae2b44de93e3299f8fb050866ab57fca150d5c93dd59e5798aba8825494bc6e",
        "declared_hash": "ca4bf6639b80b98dd0dffcf7b67855a0a9717e22ceca6576df57e0c029346974",
        "hash_reproducible": true,
        "name": "trust_registry",
        "payload_hash": "13b69e349e4e0d309d4ee9af06382b4f8e0a1328d39b33bbfd0d5ab66cb65fc0",
        "present": true,
        "status": "ready",
        "target_level": "RDLLM-L51",
        "version": "rdllm-trust-registry/v1"
      }
    ]
  },
  "audit_decision": {
    "confidential_audit_approved": true,
    "decision": "publish_universal_confidential_attribution_audit",
    "direct_settlement_confidentially_auditable": true,
    "failed_checks": [],
    "failure_modes": [],
    "publication_authorized": true,
    "safe_output_policy": "serve_attributed_answers_only_when_l143_claims_have_confidential_private_evidence_proofs_quorum_and_challenge_paths"
  },
  "audit_domain_rows": [
    {
      "audit_domain": "citation_grounding_replay",
      "audit_domain_row_hash": "a3973ccaf298805ef135c01a824e5701978347f49f248136227f912410a5737e",
      "covered": true,
      "fail_closed": true,
      "opening_policy_hash": "1ebdaa24ce6fc2e8aed8736d7c323aa487c2b80865856fc17c9a0f676f083c89",
      "private_evidence_commitment": "646256923adbe47c79607115d792ee595981fb965d814a3d3e05c0e40aadebb3",
      "proof_mechanism_root": "ea87a2eb068702a3a52f8ebac2af4cd598e2b7951b3a83b2fd1ddde25c806236",
      "public_claim_hash": "c524fe3ea1beb41d02537a99a841525c0c664128b61c1d0266f462efbd4f1184",
      "ready": true,
      "required": true,
      "retention_policy_hash": "d4930df1d24776aca1daac37b35099dfecd67dcb05a577d61673537b1318f5ef",
      "verifier_hash": "3de271e043e69d871cb4e375004ee90bb2c853c84eba11573e6e57ae7845e288"
    },
    {
      "audit_domain": "creator_query_response",
      "audit_domain_row_hash": "a79d9beded64f4052956bcc64222353030a2dca25f671b0541c9e076785ea389",
      "covered": true,
      "fail_closed": true,
      "opening_policy_hash": "916842b0844bef3b0c9a869c7dbb3d998f90e9a427dc175b86dd993154082d92",
      "private_evidence_commitment": "d6b05bb64bc09083172d8bb4bcaa3e2ca29e932b8477fce1e1793fdf6ce3db2b",
      "proof_mechanism_root": "07caff05986c8498acd971364889232b0e639a8f0e972847e1fd4a6fb4acd55b",
      "public_claim_hash": "02f6c0fbb3212e3c638c2c67d58af08c56e4ffdd6d56eea1b38ef44c60f19712",
      "ready": true,
      "required": true,
      "retention_policy_hash": "7b62e28033f78f56ef9ee2e960f3bf6d842545b6e89c2470fa5d49baccd1459d",
      "verifier_hash": "54fe91c048658a2b936410e6581385998790889e728a96f1a2923b79c56f6050"
    },
    {
      "audit_domain": "distillation_and_synthetic_lineage",
      "audit_domain_row_hash": "2aa4a3444a42be56deeae916ec7abfcded968d69faeb105d09cc87f2ea85331c",
      "covered": true,
      "fail_closed": true,
      "opening_policy_hash": "7a25bdd6df5aee55ec8f8a2500dbf7ebae7e7be1c96a91b91252658f4b78a3fe",